[
 {
  "id": "chase-freedom-flex",
  "name": "Chase Freedom Flex",
  "issuer": "chase",
  "kind": "personal",
  "recommendable": true,
  "annualFee": 0.0,
  "reportsToPersonal": true,
  "currency": "ultimate-rewards",
  "bonusTypes": [
   "transferable",
   "cashback"
  ],
  "welcomeBonus": {
   "points": 25000.0,
   "displayedAsCash": 250.0
  },
  "typicalMinSpend": {
   "amount": 500.0,
   "months": 3
  },
  "bonusRules": {
   "cooldownMonths": 24,
   "cooldownBasis": "bonus",
   "blockedWhileHeld": true
  },
  "sourceUrl": "https://creditcards.chase.com/cash-back-credit-cards/freedom/flex",
  "verifiedOn": "2026-10-29"
 },
 {
  "id": "chase-freedom-rise",
  "name": "Chase Freedom Rise",
  "issuer": "chase",
  "kind": "personal",
  "recommendable": false,
  "annualFee": 0.0,
  "reportsToPersonal": true,
  "bonusRules": {
   "cooldownMonths": 24,
   "cooldownBasis": "bonus",
   "blockedWhileHeld": true
  },
  "sourceUrl": "https://creditcards.chase.com/cash-back-credit-cards/freedom/rise",
  "verifiedOn": "2026-09-20"
 },
 {
  "id": "chase-freedom-unlimited",
  "name": "Chase Freedom Unlimited",
  "issuer": "chase",
  "kind": "personal",
  "recommendable": true,
  "annualFee": 0.0,
  "reportsToPersonal": true,
  "currency": "ultimate-rewards",
  "bonusTypes": [
   "transferable",
   "cashback"
  ],
  "welcomeBonus": {
   "points": 20000.0,
   "displayedAsCash": 200.0
  },
  "typicalMinSpend": {
   "amount": 500.0,
   "months": 3
  },
  "bonusRules": {
   "cooldownMonths": 24,
   "cooldownBasis": "bonus",
   "blockedWhileHeld": true
  },
  "sourceUrl": "https://creditcards.chase.com/cash-back-credit-cards/freedom/unlimited",
  "verifiedOn": "2026-10-29"
 },
 {
  "id": "chase-sapphire-preferred",
  "name": "Chase Sapphire Preferred",
  "issuer": "chase",
  "kind": "personal",
  "recommendable": true,
  "annualFee": 95.0,
  "reportsToPersonal": true,
  "currency": "ultimate-rewards",
  "bonusTypes": [
   "transferable",
   "cashback"
  ],
  "welcomeBonus": {
   "points": 75000.0
  },
  "typicalMinSpend": {
   "amount": 5000.0,
   "months": 3
  },
  "unlocksTransfers": true,
  "bonusRules": {
   "onceInLifetime": true
  },
  "sourceUrl": "https://creditcards.chase.com/rewards-credit-cards/sapphire/preferred",
  "verifiedOn": "2026-10-29"
 },
 {
  "id": "chase-sapphire-reserve",
  "name": "Chase Sapphire Reserve",
  "issuer": "chase",
  "kind": "personal",
  "recommendable": true,
  "annualFee": 795.0,
  "reportsToPersonal": true,
  "currency": "ultimate-rewards",
  "bonusTypes": [
   "transferable",
   "cashback"
  ],
  "welcomeBonus": {
   "points": 100000.0
  },
  "typicalMinSpend": {
   "amount": 6000.0,
   "months": 3
  },
  "unlocksTransfers": true,
  "bonusRules": {
   "onceInLifetime": true
  },
  "sourceUrl": "https://creditcards.chase.com/rewards-credit-cards/sapphire/reserve",
  "verifiedOn": "2026-10-29"
 },
 {
  "id": "chase-united-explorer",
  "name": "United Explorer Card",
  "issuer": "chase",
  "kind": "personal",
  "recommendable": true,
  "annualFee": 150.0,
  "firstYearFeeWaived": true,
  "reportsToPersonal": true,
  "currency": "united-mileageplus",
  "coBrandedProgram": "united-mileageplus",
  "bonusTypes": [
   "airline"
  ],
  "welcomeBonus": {
   "points": 70000.0
  },
  "typicalMinSpend": {
   "amount": 3000.0,
   "months": 3
  },
  "bonusRules": {
   "cooldownMonths": 24,
   "cooldownBasis": "bonus",
   "blockedWhileHeld": true
  },
  "sourceUrl": "https://creditcards.chase.com/travel-credit-cards/united/united-explorer",
  "verifiedOn": "2026-10-29"
 },
 {
  "id": "chase-united-gateway",
  "name": "United Gateway Card",
  "issuer": "chase",
  "kind": "personal",
  "recommendable": true,
  "annualFee": 0.0,
  "reportsToPersonal": true,
  "currency": "united-mileageplus",
  "coBrandedProgram": "united-mileageplus",
  "bonusTypes": [
   "airline"
  ],
  "welcomeBonus": {
   "points": 40000.0
  },
  "typicalMinSpend": {
   "amount": 1000.0,
   "months": 3
  },
  "bonusRules": {
   "cooldownMonths": 24,
   "cooldownBasis": "bonus",
   "blockedWhileHeld": true
  },
  "sourceUrl": "https://creditcards.chase.com/travel-credit-cards/united/united-gateway",
  "verifiedOn": "2026-10-29"
 },
 {
  "id": "chase-united-quest",
  "name": "United Quest Card",
  "issuer": "chase",
  "kind": "personal",
  "recommendable": true,
  "annualFee": 350.0,
  "reportsToPersonal": true,
  "currency": "united-mileageplus",
  "coBrandedProgram": "united-mileageplus",
  "bonusTypes": [
   "airline"
  ],
  "welcomeBonus": {
   "points": 80000.0
  },
  "typicalMinSpend": {
   "amount": 4000.0,
   "months": 3
  },
  "bonusRules": {
   "cooldownMonths": 24,
   "cooldownBasis": "bonus",
   "blockedWhileHeld": true
  },
  "sourceUrl": "https://creditcards.chase.com/travel-credit-cards/united/united-quest",
  "verifiedOn": "2026-10-29"
 },
 {
  "id": "chase-united-club-infinite",
  "name": "United Club Infinite Card",
  "issuer": "chase",
  "kind": "personal",
  "recommendable": true,
  "annualFee": 695.0,
  "reportsToPersonal": true,
  "currency": "united-mileageplus",
  "coBrandedProgram": "united-mileageplus",
  "bonusTypes": [
   "airline"
  ],
  "welcomeBonus": {
   "points": 90000.0
  },
  "typicalMinSpend": {
   "amount": 5000.0,
   "months": 3
  },
  "bonusRules": {
   "cooldownMonths": 24,
   "cooldownBasis": "bonus",
   "blockedWhileHeld": true
  },
  "sourceUrl": "https://creditcards.chase.com/travel-credit-cards/united/club-infinite",
  "verifiedOn": "2026-10-29"
 },
 {
  "id": "chase-marriott-bold",
  "name": "Marriott Bonvoy Bold Credit Card",
  "issuer": "chase",
  "kind": "personal",
  "recommendable": true,
  "annualFee": 0.0,
  "reportsToPersonal": true,
  "currency": "marriott-bonvoy",
  "coBrandedProgram": "marriott-bonvoy",
  "bonusTypes": [
   "hotel"
  ],
  "welcomeBonus": {
   "points": 45000.0
  },
  "typicalMinSpend": {
   "amount": 1000.0,
   "months": 3
  },
  "bonusRules": {
   "marriottMatrixKey": "chase-marriott-bold"
  },
  "sourceUrl": "https://creditcards.chase.com/travel-credit-cards/marriott-bonvoy/bold",
  "verifiedOn": "2026-10-29"
 },
 {
  "id": "chase-marriott-bountiful",
  "name": "Marriott Bonvoy Bountiful Credit Card",
  "issuer": "chase",
  "kind": "personal",
  "recommendable": true,
  "annualFee": 250.0,
  "reportsToPersonal": true,
  "currency": "marriott-bonvoy",
  "coBrandedProgram": "marriott-bonvoy",
  "bonusTypes": [
   "hotel"
  ],
  "welcomeBonus": {
   "points": 85000.0
  },
  "typicalMinSpend": {
   "amount": 4000.0,
   "months": 3
  },
  "bonusRules": {
   "marriottMatrixKey": "chase-marriott-bountiful"
  },
  "sourceUrl": "https://creditcards.chase.com/travel-credit-cards/marriott-bonvoy/bountiful",
  "verifiedOn": "2026-10-29"
 },
 {
  "id": "chase-marriott-boundless",
  "name": "Marriott Bonvoy Boundless Credit Card",
  "issuer": "chase",
  "kind": "personal",
  "recommendable": true,
  "annualFee": 95.0,
  "reportsToPersonal": true,
  "currency": "marriott-bonvoy",
  "coBrandedProgram": "marriott-bonvoy",
  "bonusTypes": [
   "hotel"
  ],
  "welcomeBonus": {
   "freeNights": 3,
   "otherValue": 822
  },
  "typicalMinSpend": {
   "amount": 3000.0,
   "months": 3
  },
  "bonusRules": {
   "marriottMatrixKey": "chase-marriott-boundless"
  },
  "sourceUrl": "https://creditcards.chase.com/travel-credit-cards/marriott-bonvoy/boundless",
  "verifiedOn": "2026-10-29"
 },
 {
  "id": "chase-ihg-premier",
  "name": "IHG One Rewards Premier Credit Card",
  "issuer": "chase",
  "kind": "personal",
  "recommendable": true,
  "annualFee": 150.0,
  "reportsToPersonal": true,
  "currency": "ihg-one-rewards",
  "coBrandedProgram": "ihg-one-rewards",
  "bonusTypes": [
   "hotel"
  ],
  "welcomeBonus": {
   "points": 180000.0
  },
  "typicalMinSpend": {
   "amount": 3000.0,
   "months": 3
  },
  "bonusRules": {
   "cooldownMonths": 24,
   "cooldownBasis": "bonus",
   "cooldownFamily": "ihg-personal",
   "blockedWhileHeld": true
  },
  "sourceUrl": "https://creditcards.chase.com/travel-credit-cards/ihg-rewards-club/premier",
  "verifiedOn": "2026-10-29"
 },
 {
  "id": "chase-ihg-premier-select",
  "name": "IHG One Rewards Premier Select Credit Card",
  "issuer": "chase",
  "kind": "personal",
  "recommendable": true,
  "annualFee": 350.0,
  "reportsToPersonal": true,
  "currency": "ihg-one-rewards",
  "coBrandedProgram": "ihg-one-rewards",
  "bonusTypes": [
   "hotel"
  ],
  "welcomeBonus": {
   "points": 200000.0
  },
  "typicalMinSpend": {
   "amount": 5000.0,
   "months": 3
  },
  "bonusRules": {
   "cooldownMonths": 24,
   "cooldownBasis": "bonus",
   "cooldownFamily": "ihg-personal",
   "blockedWhileHeld": true
  },
  "sourceUrl": "https://creditcards.chase.com/travel-credit-cards/ihg-rewards-club/premier-select",
  "verifiedOn": "2026-10-29"
 },
 {
  "id": "chase-ihg-traveler",
  "name": "IHG One Rewards Credit Card",
  "issuer": "chase",
  "kind": "personal",
  "recommendable": true,
  "annualFee": 0.0,
  "reportsToPersonal": true,
  "currency": "ihg-one-rewards",
  "coBrandedProgram": "ihg-one-rewards",
  "bonusTypes": [
   "hotel"
  ],
  "welcomeBonus": {
   "points": 125000.0
  },
  "typicalMinSpend": {
   "amount": 2000.0,
   "months": 3
  },
  "bonusRules": {
   "cooldownMonths": 24,
   "cooldownBasis": "bonus",
   "cooldownFamily": "ihg-personal",
   "blockedWhileHeld": true
  },
  "sourceUrl": "https://creditcards.chase.com/travel-credit-cards/ihg-rewards-club/one-rewards",
  "verifiedOn": "2026-10-29"
 },
 {
  "id": "chase-world-of-hyatt",
  "name": "World of Hyatt Credit Card",
  "issuer": "chase",
  "kind": "personal",
  "recommendable": true,
  "annualFee": 95.0,
  "reportsToPersonal": true,
  "currency": "world-of-hyatt",
  "coBrandedProgram": "world-of-hyatt",
  "bonusTypes": [
   "hotel"
  ],
  "welcomeBonus": {
   "points": 30000.0
  },
  "typicalMinSpend": {
   "amount": 3000.0,
   "months": 3
  },
  "bonusRules": {
   "cooldownMonths": 24,
   "cooldownBasis": "bonus",
   "blockedWhileHeld": true
  },